id,category,name,url,image_url,brand,price_text,sku,breadcrumbs,description,specs,created_at,updated_at
121,drivetrain_bottom_brackets,Shimano XT / SLX BB-MT801 Hollowtech II Bottom Bracket,https://www.bike-components.de/en/Shimano/XT-SLX-BB-MT801-Hollowtech-II-Bottom-Bracket-p90360/,https://www.bike-components.de/assets/p/i/1280x960/0f929bbe8a503e58.jpg,Shimano,13.99€,90360,,"Shimano XT / SLX BB-MT801 bottom bracket for frames with BSA thread The Shimano BB-MT801 is an aluminium centre tube bottom bracket designed to fit a 24 mm axle crankset into a frame with a BSA bearing. With the enclosed spacers, it is suitable for shell width of both 73 mm and 68 mm. Shimano recommends the BB-MT801 for the cranksets of the XT and SLX series as well as for some no-group models from the MTB range. It features a high-quality, sealed steel bearing. The bearing cups are made of anodised aluminium. In combination with a corresponding crankset, this bottom bracket and its Hollowtech II technology ensures stability and efficiency with every pedal rotation. Recommended for: XT FC-M8100, FC-M8120, FC-M8130SLX FC-M7100, FC-M7120, FC-M7130XT FC-M8000CUES FC-U8000FC-MT700, FC-MT600XT FC-T8000 anodised bearing cupshigh-quality bearingssealed for long service lifealuminium bottom bracket centre tube Hollowtech II Shimano Hollowtech II is a crank bottom bracket system designed to achieve an ideal ratio of stiffness, weight and rotational efficiency. It is based on an integration of the bottom bracket and the right crank arm and works with a 24 mm axle or bearing diameter, which has proven to be optimal in terms of stability. In many cases, the bearing cups are on the outside so that the load is better distributed. High-quality precision seals ensure a long service life. IBBMT801B Shimano BB-MT801 bottom bracket, consisting of: 1 x right bearing cup with bearings1 x left bearing cup with bearings1 x bottom bracket centre sleeve3 x spacer 2.5 mm bottom bracket toolTL-FC32orTL-FC36, or tool insertTL-FC33tool adapterTL-FC25orTL-FC37","{""Application"": ""Cross Country, All Mountain, Enduro, City & Touring"", ""Type"": ""BSA"", ""Shell Width"": ""68 mm / 73 mm"", ""Axle Diameter"": ""24 mm (Hollowtech II)"", ""Bearings"": ""steel"", ""Bottom Bracket Cup Material"": ""aluminium"", ""Bottom Bracket Centre Tube Material"": ""aluminium""}",2025-12-25 15:30:34,2025-12-27 13:25:00
122,drivetrain_bottom_brackets,Shimano SM-BB72-41B Hollowtech II Press Fit 41 x 86.5 mm Bottom Bracket,https://www.bike-components.de/en/Shimano/SM-BB72-41B-Hollowtech-II-Press-Fit-41-x-86-5-mm-Bottom-Bracket-p35879/,https://www.bike-components.de/assets/p/i/1280x960/25bdd2f34c4abe91.jpg,Shimano,29.99€,35879,,"The SM-BB72-41B bottom bracket by Shimano - Press Fit for road and SLX cranks Shimano SM-BB72-41B is a press fit bottom bracket recommended for Ultegra and 105 11-speed and Metrea City cranks. Small ball bearings help save on weight. This Hollowtech II bottom bracket also has a shaft diameter of 24 mm, which has proven to be optimal in terms of stiffness and rotational efficiency. Recommended for: Ultegra FC-R8100, FC-R8100-P, FC-R8000, FC-6800105 FC-R7100, FC-R7000, FC-5800GRX FC-RX820, FC-RX810Metrea FC-U5000FC-RS500 small ball bearings for low weight Hollowtech II Shimano Hollowtech II is a crank bottom bracket system designed to achieve an ideal ratio of stiffness, weight and rotational efficiency. It is based on an integration of the bottom bracket and the right crank arm and works with a 24 mm axle or bearing diameter, which has proven to be optimal in terms of stability. In many cases, the bearing cups are on the outside so that the load is better distributed. High-quality precision seals ensure a long service life. I-SMBB7241B 1 x Shimano SM-BB72-41B right bearing cup, with bearings1 x Shimano SM-BB72-41B left bearing cup, with bearings1 x Shimano bottom bracket centre sleeve installation toolTL-BB12removal toolTL-BB13","{""Application"": ""Road, City"", ""Type"": ""press fit BB86"", ""Shell Diameter"": ""41 mm"", ""Shell Width"": ""86.5 mm"", ""Axle Diameter"": ""24 mm (Hollowtech II)"", ""Bearings"": ""steel"", ""Bottom Bracket Cup Material"": ""synthetic resin""}",2025-12-25 15:30:37,2025-12-27 13:25:12
123,drivetrain_bottom_brackets,Shimano BB-RS500-PB Hollowtech II Press Fit 41 x 86.5 mm Bottom Bracket,https://www.bike-components.de/en/Shimano/BB-RS500-PB-Hollowtech-II-Press-Fit-41-x-86-5-mm-Bottom-Bracket-p79037/,https://www.bike-components.de/assets/p/i/1280x960/54a3ece8f1ff90e1.jpg,Shimano,from9.99€,79037,,"Shimano BB-RS500-PB bottom bracket - Press Fit for GRX, Tiagra and other cranks The Press Fit BB-RS500-PB bottom bracket is recommended by Shimano for the GRX, Tiagra, Sora and Claris series. This allows a Hollowtech II or 2-piece crank with a 24 mm axle to be mounted in a road frame with an 86.5 mm bottom bracket width and a 41 mm shell diameter. The bottom bracket is made from a synthetic material and has black bearing cups. Recommended for: GRX FC-RX610, FC-RX600Tiagra FC-4700, FC-4703Sora FC-R3030, FC-R3000Claris FC-R2030, FC-R2000FC-RS520, FC-RS510, FC-RS400 Hollowtech II Shimano Hollowtech II is a crank bottom bracket system designed to achieve an ideal ratio of stiffness, weight and rotational efficiency. It is based on an integration of the bottom bracket and the right crank arm and works with a 24 mm axle or bearing diameter, which has proven to be optimal in terms of stability. In many cases, the bearing cups are on the outside so that the load is better distributed. High-quality precision seals ensure a long service life. E-BBRS500PB 1 x Shimano BB-RS500-PB right bearing cup, with bearings1 x Shimano BB-RS500-PB left bearing cup, with bearings1 x Shimano bottom bracket centre sleeve installation toolTL-BB12removal toolTL-BB13","{""Application"": ""Road, Gravel, City"", ""Type"": ""press fit BB86"", ""Shell Diameter"": ""41 mm"", ""Shell Width"": ""86.5 mm"", ""Axle Diameter"": ""24 mm (Hollowtech II)"", ""Bearings"": ""steel"", ""Bottom Bracket Cup Material"": ""synthetic resin""}",2025-12-25 15:30:39,2025-12-27 13:25:10
124,drivetrain_bottom_brackets,Chris King ThreadFit 30 Bottom Bracket,https://www.bike-components.de/en/Chris-King/ThreadFit-30-Bottom-Bracket-p83952/,https://www.bike-components.de/assets/p/i/1280x960/79eb6f760a323774.jpg,Chris King,from82.99€,83952,,"To complete the bottom bracket you also need the matching Fit Kit . Thanks to the flexible combination of bearing and Fit Kit, Chris King bottom brackets are compatible with a wide range of crank standards and can also be retrofitted when you decide to buy a new crank. Fit Kit #1 Fit Kit #2: Fit Kit #3: Fit Kit #5: durable and easy to maintainquiet Chris King bearingsdeveloped and manufactured in Portland, Oregon (USA) 1 x Chris King ThreadFit 30 bearing cup, right1 x Chris King ThreadFit 30 bearing cup, left1 x spacer sleeve Fit Kitbottom bracket toolfor assembly","{""Application"": ""All Mountain, Road, Gravel, Cyclocross, City & Touring"", ""Type"": ""BSA"", ""Shell Width"": ""68 mm, 73 mm, 83 mm, 100 mm"", ""Axle Diameter"": ""28.99 mm (DUB), 30 mm"", ""Bearings"": ""steel"", ""Crank Axle"": ""30 mm"", ""Manufacturer Number"": ""PBB085"", ""black"": ""ABB1"", ""gold"": ""ABY1"", ""matte jet"": ""ABB2"", ""matte mango"": ""ABM2"", ""matte slate"": ""ABH2"", ""matte turquoise"": ""ABT2"", ""navy"": ""ABN1"", ""red"": ""ABR1"", ""silver"": ""ABS1"", ""two tone-black-gold"": ""ABBY""}",2025-12-25 15:30:42,2025-12-27 13:25:07
125,drivetrain_bottom_brackets,SRAM DUB Pressfit MTB 41 x 89.5-92 mm Bottom Bracket,https://www.bike-components.de/en/SRAM/DUB-Pressfit-MTB-41-x-89-5-92-mm-Bottom-Bracket-p61951/,https://www.bike-components.de/assets/p/i/1280x960/19e0b3eb23748e2a.jpg,SRAM,30.99€,61951,,"DUB combines the advantages of both axle standards, offering the perfect compromise between large bearings and axle stiffness. The new axle diameter is 28.99 mm. 00.6418.016.000 Note: to mount this bottom bracket a PROtoolcan be used. 1 x SRAM DUB Pressfit MTB bottom bracket1 x outer spacer (r) 4.5 mm (for 89.5 mm)1 x outer spacer (r) 2 mm (for 92 mm)","{""Application"": ""MTB"", ""Series"": ""DUB"", ""Type"": ""PressFit BB92"", ""Shell Diameter"": ""41 mm"", ""Shell Width"": ""89.5-92 mm"", ""Axle Diameter"": ""28.99 mm"", ""Bottom Bracket Cup Material"": ""steel""}",2025-12-25 15:30:45,2025-12-27 13:25:16
126,drivetrain_bottom_brackets,Hope Stainless Steel MTB Bottom Bracket,https://www.bike-components.de/en/Hope/Stainless-Steel-MTB-Bottom-Bracket-p27281/,https://www.bike-components.de/assets/p/i/1280x960/b46787113efada7c.jpg,Hope,from110.99€,27281,,"Durable and distinctive: the stainless steel bottom bracket by Hope The Hope bottom bracket is compatible with the most common cranks from Shimano (Hollowtech II) and Race Face. An adapter allows the use with Truvativ / GXP cranks. The CNC-milled aluminium shells are fitted with industrial bearings. The double sealed stainless steel bearings are specially made for Hope and can be pressed out of the shells easily. They run directly on the axis of the crank to ensure the durability of the bottom bracket. Race Face (X-Type)ShimanoTruvativ (only with an adapter) stainless steel for less friction, more durabilityindustrial bearings areexchangeabledouble sealed for greater durabilitya special 83 mm DH version is availablea suitable bottom bracket tool from Hope isavailable separately 1 x Hope MTB right bearing cup, incl. stainless steel bearings1 x Hope MTB left bearing cup, incl. stainless steel bearings1 x Hope bottom bracket centre tube3 x Hope spacer","{""Application"": ""All Mountain, Cross Country, Enduro, Downhill"", ""Type"": ""BSA"", ""Shell Width"": ""68 mm, 73 mm, 83 mm"", ""Axle Diameter"": ""24 mm"", ""Bearings"": ""stainless steel"", ""Bottom Bracket Cup Material"": ""aluminium"", ""Bottom Bracket Centre Tube Material"": ""aluminium"", ""Seals"": ""labyrinth"", ""black BSA 68/73"": ""BBSSXCN"", ""black BSA 83"": ""BBSSDHN"", ""silver BSA 68/73"": ""BBSSXCS"", ""silver BSA 83"": ""BBSSDHS"", ""orange BSA 68/73"": ""BBSSXCC"", ""orange BSA 83"": ""BBSSDHC"", ""red BSA 68/73"": ""BBSSXCR"", ""red BSA 83"": ""BBSSDHR"", ""blue BSA 68/73"": ""BBSSXCB"", ""blue BSA 83"": ""BBSSDHB"", ""purple BSA 68/73"": ""BBSSXCPU"", ""purple BSA 83"": ""BBSSDHPU""}",2025-12-25 15:30:53,2025-12-27 13:25:20
127,drivetrain_bottom_brackets,Shimano Saint SM-BB80 Hollowtech II Bottom Bracket,https://www.bike-components.de/en/Shimano/Saint-SM-BB80-Hollowtech-II-Bottom-Bracket-p21521/,https://www.bike-components.de/assets/p/i/1280x960/2126f4cdae767ad6.jpg,Shimano,31.99€,21521,,"The Shimano Saint bottom bracket SM-BB80 is available for different shell widths The SM-BB80 bottom bracket from Shimano is available in a version for 68 mm and 73 mm housing width and in a version for 83 mm housing width. Its golden bearing cups allow it to fit perfectly with Saint FC-M820 and FC-M825 cranks. It is a Hollowtech II bottom bracket with 24 mm axle diameter for BSA frames. Recommended for: Saint FC-M815-2, FC-M815-1, FC-M810-2, FC-M810-1, FC-M820, FC-M825XT FC-M780, FC-M785SLX FC-M660-10Deore FC-M590-10FC-M552FC-T780, FC-T781, FC-T551 larger and wider bearings for optimised load distribution, more efficient power transmission, higher rigidity, increased stabilitysimplified assembly thanks to precision bearings, longer service lifestronger centre tube stiffens frame, more possibilitieshigh-quality precision seal: bearing run remains like new for a long timeanodised bearing cups Hollowtech II Shimano Hollowtech II is a crank bottom bracket system designed to achieve an ideal ratio of stiffness, weight and rotational efficiency. It is based on an integration of the bottom bracket and the right crank arm and works with a 24 mm axle or bearing diameter, which has proven to be optimal in terms of stability. In many cases, the bearing cups are on the outside so that the load is better distributed. High-quality precision seals ensure a long service life. BSA 68/73: BSA 83: 1 x Shimano SM-BB80 right bearing cup, with bearings1 x Shimano SM-BB80 left bearing cup, with bearings1 x Shimano bottom bracket centre sleeve3 x spacers 2.5 mm bottom bracket toolTL-FC32orTL-FC36, or tool insertTL-FC33","{""Application"": ""Downhill, Enduro, Cross Country, All Mountain, Touring"", ""Series"": ""Saint, ZEE"", ""Type"": ""BSA"", ""Shell Width"": ""83 mm"", ""Axle Diameter"": ""24 mm (Hollowtech II)"", ""Bearings"": ""steel"", ""Bottom Bracket Cup Material"": ""aluminium"", ""Bottom Bracket Centre Tube Material"": ""synthetic resin"", ""Manufacturer Number"": ""I-SMBB80D""}",2025-12-25 15:30:57,2025-12-27 13:25:32
128,drivetrain_bottom_brackets,Chris King ThreadFit T47 - 24i Bottom Bracket,https://www.bike-components.de/en/Chris-King/ThreadFit-T47-24i-Bottom-Bracket-p83953/,https://www.bike-components.de/assets/p/i/1280x960/48f87d5e38e1e57c.jpg,Chris King,from181.99€,83953,,"To complete the bottom bracket you also need the matching Fit Kit . Thanks to the flexible combination of bearing and Fit Kit, Chris King bottom brackets are compatible with a wide range of crank standards and can also be retrofitted when you decide to buy a new crank. Fit Kit #4 Fit Kit #6: stiff as a press fit PF30 bottom bracketdurable and easy to maintainquiet Chris King bearingsdeveloped and manufactured in Portland, Oregon (USA) 1 x Chris King ThreadFit T47 Bottom Bracket - 24i Fit Kitbottom bracket toolfor assembly","{""Application"": ""All Mountain, Road, Gravel, Cyclocross, City & Touring"", ""Type"": ""T47"", ""Shell Width"": ""85.5 mm, 86.5 mm, 92 mm"", ""Axle Diameter"": ""22/24mm, 24 mm"", ""Bearings"": ""steel"", ""Crank Axle"": ""GXP (22/24 mm)"", ""Manufacturer Number"": ""PBB086"", ""black"": ""ACB1"", ""gold"": ""ACY1"", ""matte jet"": ""ACB2"", ""matte mango"": ""ACM2"", ""matte slate"": ""ACH2"", ""matte turquoise"": ""ACT2"", ""navy"": ""ACN1"", ""red"": ""ACR1"", ""silver"": ""ACS1""}",2025-12-25 15:31:00,2025-12-27 13:25:22
129,drivetrain_bottom_brackets,Shimano SM-BB92-41B Hollowtech II Press Fit 41 x 86.5 mm Bottom Bracket,https://www.bike-components.de/en/Shimano/SM-BB92-41B-Hollowtech-II-Press-Fit-41-x-86-5-mm-Bottom-Bracket-p34091/,https://www.bike-components.de/assets/p/i/1280x960/39ee207089c53b63.jpg,Shimano,26.99€,34091,,"The SM-BB92-41B bottom bracket by Shimano - For press fit installation Shimano SM-BB92-41B is a bottom bracket for press fit mounting of Hollowtech II cranks into a road frame with 86.5 mm bottom bracket shell. Hollowtech II means an axle diameter of 24 mm, which benefits stiffness and load capacity. Use this bottom bracket, which is characterised by its weight-saving small ball bearings, with a Dura-Ace 11-speed or 12-speed crank for an ideal combination. Recommended for: Dura-Ace FC-9000, FC-R9100, FC-R9100-P, FC-R9200, FC-R9200-P small ball bearings for low weight Hollowtech II Shimano Hollowtech II is a crank bottom bracket system designed to achieve an ideal ratio of stiffness, weight and rotational efficiency. It is based on an integration of the bottom bracket and the right crank arm and works with a 24 mm axle or bearing diameter, which has proven to be optimal in terms of stability. In many cases, the bearing cups are on the outside so that the load is better distributed. High-quality precision seals ensure a long service life. I-SMBB9241B 1 x Shimano SM-BB92-41B right bearing cup, with bearings1 x Shimano SM-BB92-41B left bearing cup, with bearings1 x Shimano bottom bracket centre sleeve installation toolTL-BB12removal toolTL-BB13","{""Application"": ""Road, Triathlon & Time Trial"", ""Type"": ""press fit BB86"", ""Shell Diameter"": ""41 mm"", ""Shell Width"": ""86.5 mm"", ""Axle Diameter"": ""24 mm (Hollowtech II)"", ""Bearings"": ""steel"", ""Bottom Bracket Cup Material"": ""synthetic resin""}",2025-12-25 15:31:03,2025-12-27 13:25:29
130,drivetrain_bottom_brackets,Shimano Deore / Alivio SM-BB52 Hollowtech II Bottom Bracket,https://www.bike-components.de/en/Shimano/Deore-Alivio-SM-BB52-Hollowtech-II-Bottom-Bracket-p40091/,https://www.bike-components.de/assets/p/i/1280x960/96be0575bde09722.jpg,Shimano,13.99€,40091,,"The Shimano Deore / Alivio bottom bracket SM-BB52 can be found again and again The SM-BB52 is a popular Shimano bottom bracket, which is used in countless cranks such as Alivio, Deore and ZEE. Its 24 mm Hollowtech II standard bearings deliver an optimal stiffness-to-weight ratio and rotational efficiency. The SM-BB52 BSA bottom bracket is available in a version for 68 and 73 mm shell width and in a version for 83 mm shell width. Recommended for: ZEE FC-M640, FC-M645Deore FC-M591, FC-T611, FC-M610, FC-M612, FC-M615, FC-M617, FC-M6000, FC-T6010, FC-M4100, FC-M5100, FC-M6100, FC-M6120, FC-M6130Alivio FC-M4050, FC-M4060, FC-T4060FC-M552-L, FC-M552-S, FC-M622, FC-M625, FC-M627FC-MT200, FC-MT500, FC-MT510, FC-MT511, FC-MT512, FC-MT610FC-T551 painted bearing cupshigh drivetrain efficiencyimproved sealing and smoother movement Hollowtech II Shimano Hollowtech II is a crank bottom bracket system designed to achieve an ideal ratio of stiffness, weight and rotational efficiency. It is based on an integration of the bottom bracket and the right crank arm and works with a 24 mm axle or bearing diameter, which has proven to be optimal in terms of stability. In many cases, the bearing cups are on the outside so that the load is better distributed. High-quality precision seals ensure a long service life. BSA: BSA 83: 1 x Shimano SM-BB52 right bearing cup, with bearings1 x Shimano SM-BB52 left bearing cup, with bearings1 x Shimano bottom bracket centre sleeve3 x spacers bottom bracket toolTL-FC32orTL-FC36, or tool insertTL-FC33","{""Application"": ""All Mountain, City & Touring, Enduro, Downhill"", ""Type"": ""BSA"", ""Shell Width"": ""83 mm"", ""Axle Diameter"": ""24 mm (Hollowtech II)"", ""Bearings"": ""steel"", ""Bottom Bracket Cup Material"": ""aluminium"", ""Bottom Bracket Centre Tube Material"": ""synthetic resin"", ""Manufacturer Number"": ""E-SMBB52D""}",2025-12-25 15:31:07,2025-12-27 13:25:37
131,drivetrain_bottom_brackets,Chris King ThreadFit T47 - 30x Bottom Bracket,https://www.bike-components.de/en/Chris-King/ThreadFit-T47-30x-Bottom-Bracket-p83956/,https://www.bike-components.de/assets/p/i/1280x960/826746f40e467f26.jpg,Chris King,from185.99€,83956,,"To complete the bottom bracket you also need the matching Fit Kit . Thanks to the flexible combination of bearing and Fit Kit, Chris King bottom brackets are compatible with a wide range of crank standards and can also be retrofitted when you decide to buy a new crank. Fit Kit #3: Fit Kit #5: stiff as a press fit PF30 bottom bracketdurable and easy to maintainquiet Chris King bearingsdeveloped and manufactured in Portland, Oregon (USA) 1 x Chris King ThreadFit T47 Bottom Bracket - 30x Fit Kitbottom bracket toolfor assembly","{""Application"": ""All Mountain, Road, Gravel, Cyclocross, City & Touring"", ""Type"": ""T47"", ""Shell Width"": ""68 mm, 73 mm"", ""Axle Diameter"": ""30 mm"", ""Bearings"": ""steel"", ""Crank Axle"": ""30 mm"", ""Manufacturer Number"": ""PBB085"", ""black"": ""AFB1"", ""gold"": ""AFY1"", ""matte jet"": ""AFB2"", ""matte mango"": ""AFM2"", ""matte slate"": ""AFH2"", ""matte turquoise"": ""AFT2"", ""navy"": ""AFN1"", ""red"": ""AFR1"", ""silver"": ""AFS1"", ""two tone-black-gold"": ""AFBY""}",2025-12-25 15:31:11,2025-12-27 13:25:26
132,drivetrain_bottom_brackets,SRAM GXP Pressfit 41 x 86.5/92 mm Bottom Bracket,https://www.bike-components.de/en/SRAM/GXP-Pressfit-41-x-86-5-92-mm-Bottom-Bracket-p24338/,https://www.bike-components.de/assets/p/i/1280x960/e762cc6502a8dbba.jpg,SRAM,from26.99€,24338,,"For the Pressfit bearing standard: the bottom bracket by Truvativ Pressfit bottom brackets use the same bearing technology as the current GXP bottom brackets and offer the same performance in terms of durability and longevity. Pressfit bottom brackets are not screwed into the bicycle frame, as is usual with GXP bottom brackets, but are pressed into the frame. Road: Application: RoadBottom Bracket Standard: BB86Shell Width: 86.5 mmManufacturer Number: 00.6415.033.000 MTB: Application: MTBBottom Bracket Standard: BB92Shell Width: 89.5 - 92 mmManufacturer Number: 00.6415.033.020 1 x Truvativ GXP Pressfit right bearing cup, incl. bearings1 x Truvativ GXP Pressfit left bearing cup, incl. bearings1 x Truvativ GXP Pressfit centre tube","{""Application"": ""MTB, Road"", ""Cup Material"": ""composite material"", ""Fitting"": ""BB86, BB92"", ""Shell Diameter"": ""41 mm"", ""Shell Width"": ""86.5mm / 89.5 - 92mm"", ""Bearings"": ""cartridge w/ steel balls (standard)"", ""Compatibility"": ""only for Pressfit frames""}",2025-12-25 15:31:15,2025-12-27 13:25:34
133,drivetrain_bottom_brackets,Shimano BB-MT800-PA Hollowtech II Press Fit Bottom Bracket 41 x 89.5-92 mm,https://www.bike-components.de/en/Shimano/BB-MT800-PA-Hollowtech-II-Press-Fit-Bottom-Bracket-41-x-89-5-92-mm-p43965/,https://www.bike-components.de/assets/p/i/1280x960/a295bc7f7374717f.jpg,Shimano,31.99€,43965,,"The BB-MT800-PA bottom bracket by Shimano - Press Fit for XT and SLX cranks Shimano BB-MT800-PA is a bottom bracket for press fit mounting in frames with 89 to 92 mm housing width and 41 mm bottom bracket diameter. It is recommended for XT, SLX and groupless Hollowtech II compatible cranks with 24 mm axle diameter. The bearing shells are made of resin. Recommended for: XT FC-M8100, FC-M8120, FC-M8130, FC-M8000, FC-T8000SLX FC-M7100, FC-M7120, FC-M7130, FC-M7000CUES FC-U8000FC-MT700, FC-MT610, FC-MT600 Hollowtech II Shimano Hollowtech II is a crank bottom bracket system designed to achieve an ideal ratio of stiffness, weight and rotational efficiency. It is based on an integration of the bottom bracket and the right crank arm and works with a 24 mm axle or bearing diameter, which has proven to be optimal in terms of stability. In many cases, the bearing cups are on the outside so that the load is better distributed. High-quality precision seals ensure a long service life. I-BBMT800PA 1 x Shimano BB-MT800-PA right bearing cup, with bearings1 x Shimano BB-MT800-PA left bearing cup, with bearings1 x Shimano bottom bracket centre sleeve1 x spacer 2.5 mm installation toolTL-BB12removal toolTL-BB13","{""Application"": ""Cross Country, All Mountain, Enduro, City & Touring"", ""Type"": ""PressFit BB92"", ""Shell Diameter"": ""41 mm"", ""Shell Width"": ""89.5 mm / 92 mm"", ""Axle Diameter"": ""24 mm (Hollowtech II)"", ""Bearings"": ""steel"", ""Bottom Bracket Cup Material"": ""synthetic resin"", ""Bottom Bracket Centre Tube Material"": ""synthetic resin""}",2025-12-25 15:31:17,2025-12-25 15:31:17
134,drivetrain_bottom_brackets,Shimano SM-BB71-41B Hollowtech II Press Fit 41 x 86.5 mm Bottom Bracket,https://www.bike-components.de/en/Shimano/SM-BB71-41B-Hollowtech-II-Press-Fit-41-x-86-5-mm-Bottom-Bracket-p32953/,https://www.bike-components.de/assets/p/i/1280x960/3682bf391366acd9.jpg,Shimano,26.99€,32953,,"Shimano bottom bracket SM-BB71-41B - Pressfit and Hollowtech II Shimano SM-BB71-41B is a press fit bottom bracket for the installation of a Hollowtech II compatible crank into a road frame with 86.5 mm case width. Per usual with Hollowtech II, the bearings have a diameter of 24 mm, as this gives the best combination of rotational efficiency, stiffness, load capacity, tightness and weight even with press fit bearings. SM-BB71-41B bottom brackets are recommended for older 10-speed road and cyclocross cranks. Recommended for: Ultegra FC-6700, FC-6700 G, FC-6750, FC-6750 G, FC-6703, FC-6703 G105 FC-5700, FC-5750, FC-5703Tiagra FC-4600, FC-4650, FC-4603Sora FC-3550, FC-3503FC-CX50FC-R603, FC-R563, FC-R460, FC-R350 Hollowtech II Shimano Hollowtech II is a crank bottom bracket system designed to achieve an ideal ratio of stiffness, weight and rotational efficiency. It is based on an integration of the bottom bracket and the right crank arm and works with a 24 mm axle or bearing diameter, which has proven to be optimal in terms of stability. In many cases, the bearing cups are on the outside so that the load is better distributed. High-quality precision seals ensure a long service life. I-SMBB7141B 1 x Shimano SM-BB71-41B right bearing cup, with bearings1 x Shimano SM-BB71-41B left bearing cup, with bearings1 x Shimano bottom bracket centre sleeve installation toolTL-BB12removal toolTL-BB13","{""Application"": ""Road, Cyclocross"", ""Type"": ""press fit BB86"", ""Shell Diameter"": ""41 mm"", ""Shell Width"": ""86.5 mm"", ""Axle Diameter"": ""24 mm (Hollowtech II)"", ""Bearings"": ""steel"", ""Bottom Bracket Cup Material"": ""synthetic resin""}",2025-12-25 15:31:19,2025-12-27 13:25:47
