id,category,name,url,image_url,brand,price_text,sku,breadcrumbs,description,specs,created_at,updated_at
315,drivetrain_internally_geared_hubs,Rohloff Splined sprocket Speedhub,https://www.bike-components.de/en/Rohloff/Splined-sprocket-Speedhub-p47930/,https://www.bike-components.de/assets/p/i/1280x960/a6acc3ad067d4159.jpg,Rohloff,from53.99€,47930,,"Quick replacement: the Plug-In Sprockets for Speedhub by Rohloff Since 2016, Rohloff has equipped all hubs in the current series with a splined sprocket system. Turning or replacing a sprocket is then very easy without a chain whip or cassette removal tool. Due to the same component basis (screw connection), existing hubs can be retrofitted or converted with this splined system. When converting from screw-on to plug-in sprockets, please also order the Splined Carrier or, in special cases, Splined Carrier S. Rohloff offers a template to check for collisions between the frame strut and the sprocket. When using the plug-in sprocket system, the chain tensioner requires the long frame bolt . The use of a closed chain guard (Hebie etc.) must be checked individually for compatibility. Due to the extended number of teeth, many chainring / sprocket combinations are possible. The permissible or desired transmission ratio can be determined with the Gears-Meters Table . In practice, a gear ratio (chainring: sprocket) of 2.5 - 2.8 has been proven to be suitable for touring/everyday use. However, if you are travelling off-road and in the mountains, you can choose your own individual gear ratio down to a minimum factor of 1.9. 1 x Rohloff splined sprocket","{""Material"": ""steel"", ""Chainline"": ""57 mm"", ""13 tooth"": ""8541"", ""14 tooth"": ""8542"", ""15 tooth"": ""8543"", ""16 tooth"": ""8544"", ""17 tooth"": ""8545"", ""18 tooth"": ""8546"", ""19 tooth"": ""8547"", ""21 tooth"": ""8549""}",2025-12-25 15:41:39,2025-12-27 13:38:42
316,drivetrain_internally_geared_hubs,Shimano Alfine Shifting Lever SL-S503 8-speed,https://www.bike-components.de/en/Shimano/Alfine-Shifting-Lever-SL-S503-8-speed-p76646/,https://www.bike-components.de/assets/p/i/1280x960/ee3d3d787d902255.jpg,Shimano,from21.99€,76646,,"The Alfine SL-S503 shifter by Shimano - compatible with shift unit CJ-8S40 The Shimano Alfine SL-S503 8-speed shifter can be used for the Alfine SG-S501 and for Nexus C6000 internally geared hubs with shifting unit CJ-8S40. Like all Rapidfire Plus shifters it features the 2-Way Release function, so the release lever can be operated by pulling with the index finger as well as by pressing with the thumb. The SL-S503 presents itself modern and sporty and convinces with exact shifting performance. It has an aluminium housing (silver or black) and levers made of synthetic resin and steel. The Alfine shifter is equipped with an easy to read gear indicator and comes complete with cable and SP41 cable housing. cable adjust Alfine SG-S501 internally geared hubsNexus SG-C6011-8R internally geared hubsNexus SG-C6001-8R internally geared hubsNexus SG-C6011-8V internally geared hubsNexus SG-C6001-8V internally geared hubsNexus SG-C6001-8C internally geared hubsNexus SG-C6001-8D internally geared hubsNexus SG-C6001-8CD internally geared hubsCJ-8S40 (Scandinavian) shift unit22.2 mm clamp diameterhandlebar grip diameter up to a maximum of 32 mm for Alfine SG-S501 and Nexus Inter-8 internally geared hubsgear indicator (above the handlebars)modern and sportyprecise shifting functionmax. number of gears per shift: 1painted housing Rapidfire Plus Rapidfire Plus is a type of Shimano shift lever construction that has been common in the mountain bike sector since 1985. Two levers, the main lever and the release lever, are used instead of a twist shifter. Rapidfire Plus shift levers, as the name suggests, ensure fast shifting. In addition, depending on the model, it is possible to downshift up to three gears with one shift stroke. 2-Way-Release With 2-Way-Release, the shifter can be pressed and pulled to shift to the smaller sprocket or chainring. This allows you to adjust the shifting process to your personal preferences. Most Rapidfire Plus shifters are equipped with 2-Way Release. 8-speed: 1 x Shimano Alfine SL-S503 shifter, incl. gear indicator1 x Shimano cable1 x Shimano cable housing (2100 mm)1 x cable housing mounting set1 x composite cap","{""Series"": ""Alfine S500"", ""Application"": ""City"", ""Gearing"": ""8-speed"", ""Mount"": ""right"", ""Type"": ""Rapidfire Plus"", ""Body Material"": ""Aluminium"", ""Lever Material"": ""resin, steel"", ""Cable"": ""stainless steel"", ""Cable Housing"": ""OT-SP41"", ""Gear Indicator"": ""yes"", ""Manufacturer Numbers"": ""E-SLS503ALSL3 (black), E-SLS503ALSS3 (silver)""}",2025-12-25 15:41:41,2025-12-27 13:38:46
317,drivetrain_internally_geared_hubs,Shimano Alfine Shift Lever SL-S700 11-speed,https://www.bike-components.de/en/Shimano/Alfine-Shift-Lever-SL-S700-11-speed-p76504/,https://www.bike-components.de/assets/p/i/1280x960/cd0a4c2f28d07cd3.jpg,Shimano,from259.00€,76504,,"The Alfine SL-S700 shifter by Shimano - visually and technically attractive The Shimano Alfine SL-S700 11-speed shift lever fits perfectly on any City bike thanks to its stylish appearance. It also boasts numerous technical refinements: As a Rapidfire Plus lever, with which several gears can be shifted down at once and it has the 2-Way Release function. This means that the shift cable can be released either by pressing with the thumb or pulling with the index finger. Added to this are Instant Release technology for super-fast shifting and Multi Release for equally fast shifting in both directions. SL-S700 is compatible with Alfine SG-S7001-11 internally geared hubs with shifting unit CJ-S700. It has an integrated visual gear indicator and is available in silver or black. Before you replace components on your e-bike, please read through the guidelines for component replacement for CE-marked e-bikes/pedelecs with pedal assistance. cable adjust Alfine SG-S7001-11 internally geared hubsCJ-S700 shifting unitEP8 EP801 e-bike series for Urban / TouringEP8 EP800 e-bike series for Urban / TouringEP6 e-bike series for Urban / Touring22.2 mm clamp diameterhandlebar grip diameter up to a maximum of 32 mm gear indicator (above the handlebars)max. number of gears per shift: 2painted housing Rapidfire Plus Rapidfire Plus is a type of Shimano shift lever construction that has been common in the mountain bike sector since 1985. Two levers, the main lever and the release lever, are used instead of a twist shifter. Rapidfire Plus shift levers, as the name suggests, ensure fast shifting. In addition, depending on the model, it is possible to downshift up to three gears with one shift stroke. 2-Way-Release With 2-Way-Release, the shifter can be pressed and pulled to shift to the smaller sprocket or chainring. This allows you to adjust the shifting process to your personal preferences. Most Rapidfire Plus shifters are equipped with 2-Way Release. Instant Release With Instant Release, the spring and thus the cable are released immediately when the lever is actuated, which ensures an enormously fast shifting process. The delay caused by a two-step shifting process with click and release is eliminated, so that the gear change is considerably accelerated and improved. Multi Release With the Multi Release, which only affects the right-hand shift lever, two gears can be shifted with one actuation of the release lever without loss of shifting speed. This is independent of whether you use a Top-Normal or a Low-Normal rear derailleur. 11-speed: 1 x Shimano Alfine SL-S700 shifter, incl. gear indicator1 x Shimano cable , incl. cable housing (2100 mm)1 x cable housing mounting set","{""Series"": ""Alfine S700"", ""Application"": ""City"", ""Gearing"": ""11-speed"", ""Mount"": ""right"", ""Type"": ""Rapidfire Plus"", ""Body Material"": ""Aluminium"", ""Lever Material"": ""steel, synthetic resin"", ""Cable"": ""stainless steel"", ""Cable Housing"": ""OT-SP41"", ""Gear Indicator"": ""yes"", ""Manufacturer Numbers"": ""I-SLS700210ALL (black), I-SLS700210ALS (silver)""}",2025-12-25 15:41:44,2025-12-27 13:38:48
318,drivetrain_internally_geared_hubs,Rohloff Chain tensioner-10 for XXL hubs,https://www.bike-components.de/en/Rohloff/Chain-tensioner-10-for-XXL-hubs-p49707/,https://www.bike-components.de/assets/p/i/1280x960/fa5aef51f407c715.jpg,Rohloff,77.99€,49707,,"For fatbikes and singlespeed: the Chain Tensioner-10 by Rohloff In addition to the Rohloff standard chain tensioner for Speedhub 54 mm chainline, there is also the chain tensioner-10. This is required for the Rohloff Speedhub 148 mm Boost hub and the XXL hubs with 190 and 197 mm. The chain tensioner-10 is also suitable for use with other hub gears and/or for use on singlespeed bikes. Depending on the derailleur hanger thickness (max. 8 mm) and axial offset (aV), a chainline of 42-50 mm (aV=0) and 50-58 mm (aV=7.5) can be achieved. The Rohloff chain tensioner-10 has a tensioning capacity of 10 links and a chain line that is offset 10 mm inwards. It is screwed into the derailleur hanger of the frame with a fastening bolt. The lateral position is adjusted via spacers. chain tensioner with 10 mm inwardly offset chain linefor fatbikes with Rohloff Boost or XXL hubs as well as for other hub gears and singlespeedsadditional mount for Shimano Direct Mount 8250-10 1 x Rohloff chain tensioner1 x short frame bolt1 x long frame bolt4 x spacers, 1 mm2 x spacers, 3 mm","{""Note"": ""If the dropout thickness is less than 7 mm and the screw sprocket with 13 teeth is used, as well as all plug-in sprockets (chainline 57 mm), a longer fastening bolt is necessary (included). You can find chainline specifications at Rohloff ."", ""Material"": ""Aluminium"", ""Capacity"": ""10 chain links"", ""Chainline"": ""75.5 - 79.5 mm (190/197 mm over locknut dimension), 51 - 55 mm (148 mm Boost), 44 - 50 mm (135 mm Singlespeed etc.)"", ""Mount"": ""derailleur hanger""}",2025-12-25 15:41:47,2025-12-27 13:38:52
319,drivetrain_internally_geared_hubs,Shimano CS-S500 Sprocket for Alfine,https://www.bike-components.de/en/Shimano/CS-S500-Sprocket-for-Alfine-p17053/,https://www.bike-components.de/assets/p/i/1280x960/dde7cfed2f210c65.jpg,Shimano,16.99€,17053,,"Shimano CS-S500 sprocket for Alfine - with integrated chain guard The Shimano CS-S500 sprocket is an accessory for Alfine 8-speed and 11-speed internally geared hubs when used in combination with vertical dropouts, the CT-S500 chain tensioner and the FC-S501 crank with double chain guard. It can also be used on certain e-bike drivetrains with internally geared hubs. The sprocket is available with 18 and 20 teeth and comes with a special chain guard ring. It is made of steel and is 2 mm thick. Its optimised tooth profile prevents the chain from falling off. Before you replace components on your e-bike, please read through the guidelines for component replacement for CE-marked e-bikes/pedelecs with pedal assistance. Alfine 11-speed / 8-speed: Nexus 8-speed / 7-speed: Nexus 8-speed / 7-speed / 3-speed: Nexus 3D: E6100 / E6180: Gearing: Di2 internally geared hub, 11-speed, 8-speedmechanical internally geared hub Alfine 11-speed, 8-speedmechanical internally geared hub Nexus 8-speed E6000: Gearing: Di2 internally geared hub, 11-speed, 8-speedmechanical internally geared hub Alfine 11-speed, 8-speedmechanical internally geared hub Nexus 8-speed E5000 / E5080: Gearing: Di2 internally geared hub, 11-speed, 8-speedmechanical internally geared hub Alfine 11-speed, 8-speedmechanical internally geared hub Nexus 8-speed special single sprocket technology with chain guardoptimised tooth profile prevents the chain from falling offchromed 1 x Shimano CS-S500 sprocket w/ chain guard","{""Application"": ""City & Touring"", ""Tooth Count"": ""18, 20"", ""Sprocket Material"": ""steel"", ""Thickness"": ""2 mm"", ""Type"": ""disc brake, V-Brake"", ""Dropouts"": ""vertical, with derailleur hanger"", ""Chain Tensioner"": ""CT-S500"", ""Crank"": ""Alfine FC-S501 crankset with double chain guard"", ""Chain"": ""9-speed"", ""Chainring"": ""SM-CRE50"", ""Chain guard"": ""double"", ""18 tooth"": ""I-CSS50018"", ""20 tooth"": ""I-CSS50020""}",2025-12-25 15:41:50,2025-12-27 13:38:54
320,drivetrain_internally_geared_hubs,Rohloff Chain tensioner,https://www.bike-components.de/en/Rohloff/Chain-tensioner-p62922/,https://www.bike-components.de/assets/p/i/1280x960/2ca750b898777e4c.jpg,Rohloff,67.99€,62922,,"Keeps your chain securely under tension: the Rohloff Chain Tensioner Efficient cycling requires a chain that's always well-tensioned. A chain tensioner is necessary on all bicycles with rear suspension, as the chain length changes when the suspension is compressed and released (exception: drive swingarm). A chain tensioner is also necessary for all hardtails and systems with a drive swingarm where the chain cannot be tensioned (i.e. without adjustable dropouts, horizontal dropouts with a long slot or eccentric bottom bracket). The standard chain tensioner is suitable for all typical frames and a chainline of 54 mm. It has a clamping capacity of 10 links. It is attached to the frame via the derailleur hanger. The position of the chain tensioner can be adjusted to the chainline of the bicycle using the included spacers. The chain tensioner can be swivelled to the rear for quick wheel removal. standard chain tensionercan be swivelled to the rearadditional mount for Shimano Direct Mountchain tensioner armavailable as spare part 8250 1 x Rohloff chain tensioner1 x short frame bolt1 x long frame bolt4 x spacers, 1 mm2 x spacers, 3 mm","{""Note"": ""If the dropout thickness is less than 7 mm and the screw sprocket with 13 teeth is used, as well as all plug-in sprockets (chainline 57 mm), a longer fastening bolt is necessary (included). You can find chainline specifications at Rohloff ."", ""Material"": ""Aluminium"", ""Capacity"": ""10 chain links"", ""Chainline"": ""54 - 58 mm (135/142 mm over locknut dimension), 72 - 75 mm (170/177 mm over locknut dimension)"", ""Mount"": ""derailleur hanger""}",2025-12-25 15:41:53,2025-12-27 13:38:59
321,drivetrain_internally_geared_hubs,Shimano Nexus twist shifter SL-C6000-8 8-speed for CJ-8S40,https://www.bike-components.de/en/Shimano/Nexus-twist-shifter-SL-C6000-8-8-speed-for-CJ-8S40-p69462/,https://www.bike-components.de/assets/p/i/1280x960/4d84c877eb6695fa.jpg,Shimano,from9.99€,69462,,"The Nexus SL-C6000-8 rotary twist shifter by Shimano - one twist is all it takes The Shimano Nexus SL-C6000-8 twist shifter can be used to operate Nexus Inter-8 internally geared hubs with CJ-8S40 shift unit. The 8-speed Revoshift shifter simply needs to be turned between thumb and forefinger - shifting couldn't be easier or safer. SL-C6000-8 scores with precise feedback and an easy-to-read gear indicator. Included are an inner cable and an SP41 cable housing. Before you replace components on your e-bike, please read through the guidelines for component replacement for CE-marked e-bikes/pedelecs with pedal assistance. cable adjust Clamp Diameter: 22.2 mm Internally Geared Hubs: Nexus SG-C6011-8RNexus SG-C6001-8RNexus SG-C6011-8VNexus SG-C6001-8VNexus SG-C6001-8CNexus SG-C6001-8DNexus SG-C6001-8CD Shifting Unit: CJ-8S40 E-Bike: EP8 EP801 for Urban / TouringEP8 EP800 for Urban / TouringEP8 E8000 for Urban / TouringEP6 for Urban / TouringSTEPS E6100STEPS E5000STEPS E6180 (Japanese market only)STEPS E5080 (Japanese market only) for Nexus Inter-8 internally geared hubsimproved overall efficiency of the internally geared hub systemredesigned inner construction for a more precise shifting feeloptimised design that complements the Nexus serieswith gear indicator (display)shifting steps (max.) per stroke: 7 Revoshift Shimano Revoshift shifters are simply twisted between thumb and forefinger to shift gears, allowing the handlebars to maintain a firm grip. This simple, safe way of shifting is particularly suitable for occasional riders and children. The stepped shape of the turn shifter ensures that it can be operated easily regardless of hand size. 8-speed: 1 x Shimano Nexus SL-C6000-8 twist shifter, incl. gear indicator1 x Shimano 2355 mm shifter cable1 x Shimano 2100 mm cable housing1 x cable anchor bolt1 x mounting set for cable housings","{""Series"": ""Nexus C6000"", ""Application"": ""City & Touring"", ""Gearing"": ""8-speed"", ""Mount"": ""right"", ""Type"": ""Revoshift"", ""Body Material"": ""synthetic resin"", ""Cable"": ""stainless steel"", ""Cable Housing"": ""OT-SP41"", ""Gear Indicator"": ""yes"", ""Manufacturer Numbers"": ""E-SLC60008DXL210LA3 (black), E-SLC60008DXS210LA3 (silver)""}",2025-12-25 15:41:56,2025-12-27 13:39:02
322,drivetrain_internally_geared_hubs,Shimano Nexus twist shifter SL-C6000-8 8-speed for CJ-8S20,https://www.bike-components.de/en/Shimano/Nexus-twist-shifter-SL-C6000-8-8-speed-for-CJ-8S20-p69461/,https://www.bike-components.de/assets/p/i/1280x960/740c749cea5f1b15.jpg,Shimano,from10.99€,69461,,"The Nexus SL-C6000-8 twist shifter by Shimano - handlebars firmly in grip The Shimano Nexus SL-C6000-8 is a twist shifter for Nexus Inter-8 internally geared hubs equipped with the CJ-8S20 shift unit. It is an 8-speed shift lever of the Revoshift type, i.e. a simple turning movement is sufficient for shifting, while the hand continues to have a firm grip on the handlebars. SL-C6000-8 scores with precise feedback and an easy-to-read gear indicator. Included are an inner cable and an SP41 cable housing. Before you replace components on your e-bike, please read through the guidelines for component replacement for CE-marked e-bikes/pedelecs with pedal assistance. cable adjust Clamp Diameter: 22.2 mm Internally Geared Hubs: Nexus SG-C6011-8RNexus SG-C6001-8RNexus SG-C6011-8VNexus SG-C6001-8VNexus SG-C6001-8CNexus SG-C6001-8DNexus SG-C6001-8CD Shifting Unit: CJ-8S20 E-Bike: EP8 EP801 for Urban / TouringEP8 EP800 for Urban / TouringEP8 E8000 for Urban / TouringEP6 for Urban / TouringSTEPS E6100STEPS E5000STEPS E6180 (Japanese market only)STEPS E5080 (Japanese market only) for Nexus Inter-8 internally geared hubsimproved overall efficiency of the internally geared hub systemredesigned inner construction for a more precise shifting feeloptimised design that complements the Nexus serieswith gear indicator (display)shifting steps (max.) per stroke: 7 Revoshift Shimano Revoshift shifters are simply twisted between thumb and forefinger to shift gears, allowing the handlebars to maintain a firm grip. This simple, safe way of shifting is particularly suitable for occasional riders and children. The stepped shape of the turn shifter ensures that it can be operated easily regardless of hand size. 8-speed: 1 x Shimano Nexus SL-C6000-8 twist shifter, incl. gear indicator1 x Shimano 2330 mm shifter cable1 x Shimano 2100 mm cable housing1 x cable anchor bolt","{""Series"": ""Nexus C6000"", ""Application"": ""City & Touring"", ""Gearing"": ""8-speed"", ""Mount"": ""right"", ""Type"": ""Revoshift"", ""Body Material"": ""synthetic resin"", ""Cable"": ""stainless steel"", ""Cable Housing"": ""OT-SP41"", ""Gear Indicator"": ""yes"", ""Manufacturer Numbers"": ""E-SLC60008L210LA3 (black), E-SLC60008S210LA3 (silver)""}",2025-12-25 15:41:58,2025-12-27 13:39:05
323,drivetrain_internally_geared_hubs,Shimano Alfine / Nexus chain tensioner CT-S500,https://www.bike-components.de/en/Shimano/Alfine-Nexus-chain-tensioner-CT-S500-p16562/,https://www.bike-components.de/assets/p/i/1280x960/bbb0c4f685671353.jpg,Shimano,from148.99€,16562,,"The Shimano Alfine Chain Tensioner CT-S500 for vertical dropouts The Shimano Alfine chain tensioner CT-S500 (in contrast to CT-S510 ) has 2 rollers and is intended for mounting the Alfine and Nexus gear hubs in frames with vertical dropouts in combination with the CS-S500 sprocket. It can be used for sprockets from 18 to 20 teeth; the difference between the chainrings must not exceed 16 teeth. There is no compatibility with 1/8"" chains. Before you replace components on your e-bike, please read through the guidelines for component replacement for CE-marked e-bikes/pedelecs with pedal assistance. for vertical dropoutsdouble roller designpainted 1 x Shimano Alfine CT-S500 chain tensioner","{""Material"": ""aluminium"", ""Gearing"": ""1x"", ""Chainring Difference (max.)"": ""16 t"", ""Largest Sprocket"": ""20 t"", ""Smallest Sprocket"": ""18 t"", ""Dropout Width"": ""5 - 9 mm"", ""Gear Hubs"": ""Alfine 11-speed, Alfine 8-speed, Nexus 8-speed, Nexus 7-speed"", ""Dropouts"": ""vertical, with derailleur hanger"", ""Brake Type"": ""Disc brake, V-brake, roller brake"", ""Chain"": ""CN-HG53, CN-HG71, CN-HG93 (9-speed super narrow)"", ""Sprocket"": ""CS-S500"", ""Crank"": ""FC-S501 with double chain guard"", ""E-Bike"": ""STEPS E6100, E6180, E6000, E5000, E5080"", ""silver"": ""I-CTS500"", ""black"": ""I-CTS500L""}",2025-12-25 15:42:00,2025-12-27 13:39:08
