id,category,name,url,image_url,brand,price_text,sku,breadcrumbs,description,specs,created_at,updated_at
225,drivetrain_chainrings,Shimano XT FC-M780 / FC-T780 / FC-T781 10-speed Chainring,https://www.bike-components.de/en/Shimano/XT-FC-M780-FC-T780-FC-T781-10-speed-Chainring-p32519/,https://www.bike-components.de/assets/p/i/1280x960/151191d3597e5e00.jpg,Shimano,from9.49€,32519,,"The Shimano XT 10-speed Chainring for the FC-M780 crank This Shimano 10-speed XT chainring is compatible with the FC-M780 crank, but also with the FC-T780 or FC-T781 touring crank, depending on the version. With its 104 mm or 64 mm bolt circle diameter, it can be used for various 3-speed gradations. The SG-X tooth profile ensures smooth and quiet shifting in the Dyna-Sys 10-speed drivetrain. The chainrings are designed to work optimally with the other front drivetrain components (HyperDrive). large chainring anodised, medium and small chainring plated 24 tooth: 32 tooth: 36 tooth: 42 tooth: 44 tooth: 48 tooth (FC-T780): 48 tooth (FC-T781): The type designation (one or two characters) helps identify the compatibility of various chainrings with other chainrings. Because the larger chainrings have specially-formed teeth and upward shifting assistance, only particular smaller chainrings will match to ensure proper shifting performance. An XY chainring should only be combined with another XY chainring. This applies to all other types as well. 1 x Shimano XT FC-M780 chainring4 x chainring bolts(32 tooth only)","{""Application"": ""All Mountain, City & Touring"", ""Mount"": ""104/64 mm bolt circle diameter, 4-arm"", ""Teeth"": ""24 t, 32 t, 36 t, 42 t, 44 t, 48 t"", ""Gearing"": ""3x10-speed"", ""Combinations"": ""24-32-42 T, 24-32-44 T, 26-36-48 T"", ""Material"": ""aluminium (24 t + 26 t, 42 t to 48 t), steel-carbon composite (32 t)"", ""Note"": ""The 26 tooth chainring for FC-T780 and FC-T781 (Y-1J226000) is identical to the XT chainring FC-M771-K ."", ""Type"": ""AL"", ""Compatibility"": ""XT FC-T781, also suited for FC-T780, FC-T551"", ""Bolt Circle Diameter"": ""104 mm"", ""Manufacturer Number"": ""Y-1MP98050""}",2025-12-25 15:36:22,2025-12-27 13:32:22
226,drivetrain_chainrings,SRAM X-Sync Road Direct Mount Chainring for Rival,https://www.bike-components.de/en/SRAM/X-Sync-Road-Direct-Mount-Chainring-for-Rival-p82856/,https://www.bike-components.de/assets/p/i/1280x960/0cac4d4707306483.jpg,SRAM,from33.99€,82856,,"This SRAM chainring with X-Sync tooth design is attached via Direct Mount and is best combined with Rival cranks on road, gravel or cyclocross bikes. It has a lasered finish to make it extra durable. optimum chain hold with alternating wide and narrow X-Sync™ tooth designlasered finish for even greater durability X-Sync™ X-Sync 1x chainrings by SRAM provide the highest performance and durability. The long SRAM X-Sync tooth edges grip the chain earlier than traditional triangular teeth. The sharp and narrow tooth profile and the rounded bevelled edges support the chain guide. To provide the best possible performance on muddy terrain, the X-Sync chainrings have recesses for removing dirt and mud for the inner chain links and rollers. 1 x SRAM X-Sync Road chainring","{""Application"": ""Road, Gravel, Cyclocross"", ""Mount"": ""SRAM Direct Mount"", ""Teeth"": ""38, 40, 42, 44, 46 tooth"", ""Gearing"": ""1x12-speed"", ""Material"": ""Aluminium"", ""38 tooth"": ""00.6218.027.000"", ""40 tooth"": ""00.6218.027.001"", ""42 tooth"": ""00.6218.027.002"", ""44 tooth"": ""00.6218.027.003"", ""46 tooth"": ""00.6218.027.004""}",2025-12-25 15:36:25,2025-12-27 13:32:14
227,drivetrain_chainrings,"SRAM X-Sync Road, 12-speed, 107 mm BCD Chainring",https://www.bike-components.de/en/SRAM/X-Sync-Road-12-speed-107-mm-BCD-Chainring-p69108/,https://www.bike-components.de/assets/p/i/1280x960/7a4003ef25d73c43.jpg,SRAM,from26.99€,69108,,"X-Range™ technology for more range and smoother gear changesX-Sync™ chainring technology offers maximum chain control with wide and narrow teethmore durable laser-etched chainring finishcan be installed with a single tool X-Sync™: X-Sync™ 1x chainrings by SRAM provides the highest performance and durability. Long SRAM X-Sync™ tooth edges grip the chain at a higher rate than standard triangular teeth. The sharp and narrow tooth profile and the rounded bevelled edges support the chain guide. To guarantee the best possible performance on muddy terrain, X-Sync™ chainrings have recesses for the inner chain links and rollers to remove dirt and mud. German-made X-Sync™ chainrings are an important part of SRAM 1x drivetrains. 1 x SRAM X-Sync Road chainring","{""Application"": ""Road"", ""Attachment"": ""107 mm bolt circle diameter, 4-arm"", ""Teeth"": ""36 t, 38 t, 40 t, 42 t, 44 t, 46 t"", ""Gearing"": ""1x12-speed"", ""Material"": ""aluminium"", ""blast black"": ""black chainring w/ black-grey accents"", ""polar grey"": ""grey chainring w/ grey accents"", ""blast black / 36 tooth"": ""00.6218.014.006"", ""blast black / 38 tooth"": ""00.6218.014.007"", ""blast black / 40 tooth"": ""00.6218.014.008"", ""blast black / 42 tooth"": ""00.6218.014.009"", ""blast black / 44 tooth"": ""00.6218.014.000"", ""blast black / 46 tooth"": ""00.6218.014.001"", ""polar grey / 40 tooth"": ""00.6218.014.002"", ""polar grey / 42 tooth"": ""00.6218.014.003"", ""polar grey / 44 tooth"": ""00.6218.014.004"", ""polar grey / 46 tooth"": ""00.6218.014.005""}",2025-12-25 15:36:29,2025-12-27 13:32:25
228,drivetrain_chainrings,Shimano Tiagra FC-4700 10-speed Chainring,https://www.bike-components.de/en/Shimano/Tiagra-FC-4700-10-speed-Chainring-p48607/,https://www.bike-components.de/assets/p/i/1280x960/ce5ebe06b30bb0bb.jpg,Shimano,from9.49€,48607,,"The Shimano Tiagra 10-speed Chainring for the FC-4700 crank This Shimano 10-speed chainring is a replacement part for the Tiagra FC-4700 crank and can be used for the 2-speed combinations 34-50 and 36-52 (bolt circle diameter 110 mm). The small chainrings are made of aluminium, the large ones of an aluminium-plastic composite. Tiagra FC-4700 anodised 34 tooth: 36 tooth: 50 tooth: 52 tooth: The type designation (one or two characters) helps identify the compatibility of various chainrings with other chainrings. Because the larger chainrings have specially-formed teeth and upward shifting assistance, only particular smaller chainrings will match to ensure proper shifting performance. An XY chainring should only be combined with another XY chainring. This applies to all other types as well. 1 x Shimano Tiagra FC-4700 chainring","{""Application"": ""Road, City"", ""Mount"": ""110 mm pitch circle, 4-arm asymmetrical"", ""Teeth"": ""34 t, 36 t, 50 t, 52 t"", ""Gearing"": ""2x10-speed"", ""Combinations"": ""34-50 t, 36-52 t"", ""Material"": ""aluminium (34 + 36 t), aluminium/composite (GFRP 50 t + 52 t)"", ""Type"": ""ML"", ""Manufacturer Number"": ""Y-1RC98060""}",2025-12-25 15:36:32,2025-12-27 13:32:29
229,drivetrain_chainrings,Wolf Tooth Components 110 BCD Gravel / CX / Road Chainring,https://www.bike-components.de/en/Wolf-Tooth-Components/110-BCD-Gravel-CX-Road-Chainring-p76896/,https://www.bike-components.de/assets/p/i/1280x960/6bf7ed3fe79c815f.jpg,Wolf Tooth Components,from74.99€,76896,,"The Wolf Tooth Components 110 BCD Gravel / CX / Road chainring can be used for 5-arm cranks with 110 mm bolt circle and is also compatible with Flattop chains. Crank: 5-arm cranks with 110 mm bolt circle diameternotcompatible with Shimano Dura-Ace 9000 or Ultegra 6800notcompatible with Campagnolo CX10/11 Chain: all 9-speed, 10-speed and 11-speed chainsSRAM Flattop, SRAM Eagle, Campagnolo and KMC 12-speed chains10-speed chain recommended for 9-speed drivetrains Chainring Bolts: 6 mm boltsfor 1x (original bolts for 2x do not fit) Wolf Tooth Wide-Narrow designmounting position outside or inside (sufficient distance to chainstay provided)chainline varies with mounting positionMade in the USA Drop-Stop® B Wolf Tooth has invested countless hours in the design, prototyping and testing of their Wide-Narrow chainrings and has developed a highly innovative tooth profile. Test riders around the world have confirmed that this design brings unparalleled performance. The right side of the chainring tooth has a different shape than the left side. The right side transmits the power to the chain and the left side opens a free space for cleaning mud and dirt. Since the two sides have completely different functions, it makes sense to design them differently, true to the motto: extra reinforcement where you need it, less material where you don't. The right side of the Drop-Stop tooth is as wide as possible to distribute the load over a larger area, which also minimises wear. The left side of the Drop-Stop tooth helps to guide the chain, but it does not transmit any load. Therefore the left side is narrower than the chain roller. Wear is not an issue on this side, so Wolf Tooth was able to save material and create a better mud clearance channel. More free space means less friction and less change of the chain being dropped due to mud. In the B version, the drop-stop profile is optimised for use on wheels with drop bars. The teeth are slightly narrower and the valleys between the teeth are deeper to accommodate the larger rollers of SRAM Flattop chains. The outer sides of the narrow and wide teeth touch the chain to guide it. 1 x Wolf Tooth Components 110 BCD Gravel / CX / Road chainring","{""Application"": ""Gravel, Cyclocross, Road"", ""Mount"": ""110 mm bolt circle diameter, 5-arm"", ""Teeth"": ""34 T, 36 T, 38 T, 40 T, 42 T, 44 T, 46 T, 48 T, 50 T, 52 T"", ""Gearing"": ""1x9-speed, 1x10-speed, 1x11-speed, 1x12-speed"", ""Material"": ""aluminium (7075-T6)"", ""Note from the manufacturer"": ""It is best to use a clutch rear derailleur. For very muddy conditions a chain guide in combination with clutch rear derailleur is recommended."", ""34 tooth"": ""11034FT"", ""36 tooth"": ""11036FT"", ""38 tooth"": ""11038FT"", ""40 tooth"": ""11040FT"", ""42 tooth"": ""11042FT"", ""44 tooth"": ""11044FT"", ""46 tooth"": ""11046FT"", ""48 tooth"": ""11048FT"", ""50 tooth"": ""11050FT"", ""52 tooth"": ""11052FT""}",2025-12-25 15:36:35,2025-12-25 15:36:35
230,drivetrain_chainrings,Garbaruk Thread Mount Chainring for SRAM XX/XX SL PM 0mm Round,https://www.bike-components.de/en/Garbaruk/Thread-Mount-Chainring-for-SRAM-XX-XX-SL-PM-0mm-Round-p222557/,https://www.bike-components.de/assets/p/i/1280x960/30477923df3fb3f9.jpg,Garbaruk,from88.99€,222557,,"Dive into the world of mountain biking with the Thread Mount Chainring for SRAM XX/XX SL PM 0mm Round from Garbaruk, a perfect fit for all mountain, cross country, and MTB enthusiasts. Designed with a sleek, round shape, this chainring is your go-to for a seamless ride across any terrain. Compatible with a wide range of speeds, including 9-speed, 10-speed, 11-speed, 12-speed, and even 13-speed cassettes, it offers unparalleled versatility. Whether you're upgrading your ride or replacing a worn component, its easy thread mount design ensures a hassle-free installation, letting you hit the trails in no time. The zero offset design maintains optimal chain alignment, enhancing your bike's performance and efficiency. Crafted for durability and reliability, this chainring withstands the rigors of aggressive riding, from steep climbs to technical descents. Its compatibility with SRAM XX and XX SL cranksets makes it an essential upgrade for serious riders seeking to push their limits. Get ready to experience improved power transfer and smoother shifting, all while enjoying the beauty of the great outdoors. This chainring is not just a part; it's a gateway to new adventures and challenges on your favorite trails.",,2025-12-25 15:36:37,2025-12-27 13:32:48
231,drivetrain_chainrings,Garbaruk Thread Mount Chainring for SRAM RED XPLR AXS PM Oval,https://www.bike-components.de/en/Garbaruk/Thread-Mount-Chainring-for-SRAM-RED-XPLR-AXS-PM-Oval-p222555/,https://www.bike-components.de/assets/p/i/1280x960/d23790ab416e1259.jpg,Garbaruk,from66.99€,222555,,"Get ready to elevate your gravel and road rides with the Thread Mount Chainring for SRAM RED XPLR AXS PM Oval from Garbaruk. This oval-shaped chainring is designed to seamlessly integrate with your SRAM RED XPLR AXS power meter, enhancing your cycling experience across a wide range of speeds, from 9-speed to 13-speed setups. Its unique oval design is not just about looks; it's engineered to optimize your pedal stroke, making each rotation smoother and more efficient. Whether you're pushing hard on the gravel paths or speeding along the tarmac, this chainring ensures your power transfer is direct and effective. Compatible with a broad spectrum of drivetrains, it's the perfect upgrade for cyclists who demand versatility and performance. The installation process is straightforward, allowing you to get back on the road or trail in no time. With its durable construction, the Thread Mount Chainring is built to withstand the rigors of both gravel grinding and road racing. Upgrade your ride and feel the difference in your pedal efficiency and overall cycling performance.",,2025-12-25 15:36:41,2025-12-27 13:32:45
232,drivetrain_chainrings,Garbaruk Thread Mount Chainring for SRAM XX/XX SL PM 3 mm Round,https://www.bike-components.de/en/Garbaruk/Thread-Mount-Chainring-for-SRAM-XX-XX-SL-PM-3-mm-Round-p222558/,https://www.bike-components.de/assets/p/i/1280x960/a2ba8acf0f1b9c25.jpg,Garbaruk,from66.99€,222558,,"Experience the ultimate upgrade for your all-mountain, cross-country, or MTB adventures with the Thread Mount Chainring for SRAM XX/XX SL PM 3 mm Round from Garbaruk. This high-quality chainring is designed to fit seamlessly with SRAM XX and XX SL cranksets, ensuring a perfect match for your bike. With compatibility across a wide range of speeds, from 9-speed to 13-speed cassettes, you're guaranteed smooth and reliable shifting on any terrain. The round design of the chainring ensures consistent performance and efficiency, optimizing your pedal stroke for maximum power transfer. The 3 mm offset provides the ideal chainline for optimal engagement and wear reduction, extending the life of your drivetrain components. Whether you're tackling steep climbs, technical descents, or fast flats, this chainring will keep you in control and ready for anything the trail throws your way. Upgrade your ride today and experience the difference in precision and durability that this chainring offers. Your mountain biking adventures will never be the same.",,2025-12-25 15:36:44,2025-12-27 13:32:52
233,drivetrain_chainrings,Garbaruk Thread Mount chainring for SRAM XX/XX SL PM 0 mm Oval,https://www.bike-components.de/en/Garbaruk/Thread-Mount-chainring-for-SRAM-XX-XX-SL-PM-0-mm-Oval-p222554/,https://www.bike-components.de/assets/p/i/1280x960/c2abcf6e57c5c428.jpg,Garbaruk,from88.99€,222554,,"Get ready to elevate your ride with the Thread Mount chainring for SRAM XX/XX SL PM 0 mm Oval from Garbaruk, designed specifically for All Mountain, Cross Country, and MTB enthusiasts. Crafted by the experts for those who demand precision and performance, this oval chainring is your ticket to a smoother, more efficient power delivery. Compatible with a wide range of speeds, from 9-speed to 13-speed cassettes, it ensures that you're always in the right gear, no matter the terrain. The oval design optimizes pedal stroke, reducing fatigue and enhancing your overall riding experience. With a direct thread mount system, installation is straightforward, allowing you to quickly upgrade and hit the trails. Its 0 mm offset ensures perfect alignment with your drivetrain, offering silent and seamless operation. Whether you're tackling steep climbs, technical descents, or just enjoying a leisurely ride through the countryside, this chainring is built to boost your performance and enjoyment. Embrace the future of cycling with this cutting-edge accessory that's designed to keep you ahead of the pack. Make every ride unforgettable with the Thread Mount chainring - where technology meets the trail.",,2025-12-25 15:36:48,2025-12-27 13:32:56
234,drivetrain_chainrings,Garbaruk Thread Mount chainring for SRAM XX/XX SL PM 3 mm Oval,https://www.bike-components.de/en/Garbaruk/Thread-Mount-chainring-for-SRAM-XX-XX-SL-PM-3-mm-Oval-p222556/,https://www.bike-components.de/assets/p/i/1280x960/c900896d6b9d69db.jpg,Garbaruk,from88.99€,222556,,"Get ready to elevate your ride with the Thread Mount chainring for SRAM XX/XX SL PM 3 mm Oval, designed specifically for the all-mountain, cross-country, and MTB enthusiasts out there. This high-quality chainring from Garbaruk is your ticket to a smoother, more efficient pedaling experience, thanks to its oval design. With compatibility across a wide range of speeds, including 9-speed, 10-speed, 11-speed, 12-speed, and even 13-speed cassettes, this chainring is versatile and ready to adapt to your riding needs. The 3 mm offset ensures optimal chain alignment, providing you with a quieter ride and reduced wear on your drivetrain components. Whether you're tackling steep climbs or fast descents, the oval shape of the chainring maximizes power transfer and efficiency at every pedal stroke. It's a breeze to install on your SRAM XX or XX SL crankset, making it an ideal upgrade for riders looking to enhance their performance on the trails. Durable and built to last, this chainring is your partner for countless adventures on the mountain. So, gear up and prepare to experience the difference in your ride with the SRAM Thread Mount chainring – your bike will thank you.",,2025-12-25 15:36:50,2025-12-27 13:33:01
235,drivetrain_chain_guides_bash_guards,SKS Chainblade,https://www.bike-components.de/en/SKS/Chainblade-p52258/,https://www.bike-components.de/assets/p/i/1280x960/909ea72830c5e6ee.jpg,SKS,from14.99€,52258,,The Chainblade is an innovative chain protection system. The combination of impact-resistant plastic elements with proven SKS technology results in an excellent chain guard. The Chainblade impresses with its high stability and very low weight. The adjustable profile allows for maximum flexibility. 38 tooth / black: Chainring Diameter (max): 158 mmTeeth (max.): 38Compatibility: for internally geared hubsColour: blackManufacturer Number: 11444 42-44 tooth / black: Chainring Diameter (max): 175 mmTeeth (max.): 42 - 44Compatibility: for internally geared hubs and chain drivesColour: blackManufacturer Number: 11444 46-48 tooth / black: Chainring Diameter (max): 199 mmTeeth (max.): 46 - 48Compatibility: for chain drivesColour: blackManufacturer Number: 11445 1 x SKS Chainbladeincl. mounting material,,2025-12-25 15:37:00,2025-12-27 13:33:17
236,drivetrain_chain_guides_bash_guards,3min19sec c.guide Chain Guide,https://www.bike-components.de/en/3min19sec/c-guide-Chain-Guide-p67838/,https://www.bike-components.de/assets/p/i/1280x960/7de90a6bfce5d154.jpg,3min19sec,22.99€,67838,,"The c.guide Chain Guide by 3min19sec - Prevents the chain from jumping off the chainring The 3min19sec c.guide chain guide counteracts chain slap and chain jumping off the chainring. It is made of plastic and therefore weighs less than 20 grams. You can use them not only for single cranks, but also for 2x or 3x gears. As far as frame, chain and chainring compatibility is concerned, there are no restrictions either. The c.guide can be mounted either on the cable guide mount or on the chainstay. no rattling or slapping of the chain against the chainstaysbetter guidance and therefore less chain drop for 1x-3x cranks complete shiftssuitable for all wheels with or without continuous cable routing under the chainstaycan be mounted on the cable guide or on the chainstay 1 x 3min19sec c.guide chain guideincl. mount and cable ties","{""Application"": ""All Mountain, Enduro"", ""Material"": ""composite material (GFRP, nylon)"", ""Compatibility"": ""up to 3x, for every frame, chain, chainring""}",2025-12-25 15:37:04,2025-12-27 13:33:14
237,drivetrain_small_parts,SKS Chainbow Chain Guard,https://www.bike-components.de/en/SKS/Chainbow-Chain-Guard-p69408/,https://www.bike-components.de/assets/p/i/1280x960/7b01af26167657e6.jpg,SKS,12.99€,69408,,"Secure protection all around: the Chainbow Chain Guard by SKS The Chainbow chain guard made of impact-resistant black composite material and aluminium offers perfect protection for your chain. Thanks to the telescopic function and the multi-adaptable holding angle, it can be freely adjusted. 38 tooth / black: Chainring Diameter (max): 158 mmTeeth (max.): 38Compatibility: for internally geared hubsColour: blackManufacturer Number: 11504 44 tooth / black: Chainring Diameter (max): 175 mmTeeth (max.): 44Compatibility: for chain drivesColour: blackManufacturer Number: 11505 48 tooth / black: Chainring Diameter (max): 199 mmTeeth (max.): 48Compatibility: for chain drivesColour: blackManufacturer Number: 11506 1 x SKS Chainbow chain guard","{""Material"": ""composite, aluminium""}",2025-12-25 15:37:06,2025-12-27 13:35:39
238,drivetrain_chain_guides_bash_guards,e*thirteen Vario Chainguide Enduro,https://www.bike-components.de/en/e-thirteen/Vario-Chainguide-Enduro-p86283/,https://www.bike-components.de/assets/p/i/1280x960/b7d147af8748891d.jpg,e*thirteen,55.99€,86283,,"The e*thirteen Vario Chainguide for Enduro bikes The Vario Chainguide by e*thirteen for enduro use is equipped with a bashguard that protects the chainring from hard impacts. Specifications: with bashguard, deforms away from the chainring on impactbolts with T25 mountcompact slideraluminium support plate CG3VPA-101 1 x e*thirteen Vario Chainguide Enduro","{""Application"": ""Enduro"", ""Material"": ""aluminium, composite"", ""Mount"": ""ISCG 05"", ""Chain Guide Capacity"": ""28 - 36 teeth""}",2025-12-25 15:37:10,2025-12-27 13:33:20
239,drivetrain_chain_guides_bash_guards,Shimano Alfine Chain Guard,https://www.bike-components.de/en/Shimano/Alfine-Chain-Guard-p23059/,https://www.bike-components.de/assets/p/i/1280x960/61cebb1a470f6501.jpg,Shimano,11.99€,23059,,"The Shimano Alfine Chain Guard - Compatible with FC-S500 and FC-S501 This chain guard is a Shimano spare part for Alfine FC-S500 and other cranks. There are versions for different chainring sizes and for mounting on the outside or inside of the chainring. The inner chain rings are made of plastic, the outer ones of aluminium. FC-S500FC-S501FC-S400 1 x Shimano Alfine chain guard","{""Size"": ""42 T, 45 T"", ""Bolt Circle Diameter"": ""130 mm"", ""Mount"": ""inner, outer"", ""black / inner 45 tooth"": ""Y-1HD63000"", ""silver / outer 39 tooth"": ""Y-1HD62000"", ""black / outer 42 tooth"": ""Y-1PB11010"", ""silver / outer 42 tooth"": ""Y-1PB11000"", ""silver / outer 45 tooth"": ""Y-1HD61000""}",2025-12-25 15:37:13,2025-12-27 13:33:26
240,drivetrain_chain_guides_bash_guards,OAK Components Grown Bashguard,https://www.bike-components.de/en/OAK-Components/Grown-Bashguard-p93122/,https://www.bike-components.de/assets/p/i/1280x960/b006ca3717f14283.jpg,OAK Components,from19.99€,93122,,"The Grown Bashguard from OAK Components can take a lot The OAK Components Grown Bashguard protects your chainring and neighbouring components such as the frame, chain and rocker arm if you hit a root while mountain biking, for example. bashguard to protect the chainring and moreinstallation possible in most cases without removing the cranktopologically optimised design: distribution of the forces acting on both screw pointstested on the trail 1 x OAK Components Grown bashguard2 x aluminium bolts2 x stainless steel banjo bolts6 x washer","{""Application"": ""All Mountain, Enduro"", ""Material"": ""aluminium"", ""Mount"": ""ISCG 05"", ""Bash Guard Capacity"": ""32 - 34 teeth (32 teeth with oval chainring)"", ""raw"": ""06-000-A01-E00"", ""black"": ""06-000-A01-E01"", ""blue"": ""06-000-A01-E02"", ""red"": ""06-000-A01-E03"", ""orange"": ""06-000-A01-E04"", ""gold"": ""06-000-A01-E05"", ""purple"": ""06-000-A01-E06"", ""copper"": ""06-000-A01-E09""}",2025-12-25 15:37:17,2025-12-27 13:33:23
241,drivetrain_chain_guides_bash_guards,Hebie Chainbar 394 Chain Guard for Internally Geared Hubs,https://www.bike-components.de/en/Hebie/Chainbar-394-Chain-Guard-for-Internally-Geared-Hubs-p77237/,https://www.bike-components.de/assets/p/i/1280x960/8af2a7f06b303885.jpg,Hebie,from17.99€,77237,,"The Hebie Chainbar 394 chain guard for internally geared hubs protects against dirt and looks elegant at the same time. internally geared hubs with 1 chainring up to 38, 40 or 48 tooth elegant, highly polished aluminium chain guard for bikes with internally geared hubsideal for the Gates belt drive or for fixiesnatural aluminium finish (polished) or shiny black25 mm profile widthriveted bracket in three different dimensionslength of chain guard measured from centre of axle 180 mm 38 tooth: 195 mm 40 tooth: 219 mm 48 tooth: 1 x Hebie Chainbar 394 internally geared hub chain guard1 x end pieces1 x inlet protection Universal Attachment for Rear Stay","{""Application"": ""City, City & Touring"", ""Capacity"": ""48-tooth"", ""Material"": ""aluminium"", ""Dimensions (Bracket)"": ""219 mm"", ""Length"": ""50 cm"", ""Width"": ""25 mm"", ""Manufacturer Numbers"": ""0394 E 219 1 (black), 0394 E 219 (polished)""}",2025-12-25 15:37:20,2025-12-27 13:33:33
